headline,url
Colombian man killed by ICE in Maine was not the agents’ target,https://english.elpais.com/usa/2026-07-14/colombian-man-killed-by-ice-in-maine-was-not-the-agents-target.html
Inside the White House: How Trump wields unchecked power to leave his mark on history,https://english.elpais.com/usa/2026-07-13/inside-the-white-house-how-trump-wields-unchecked-power-to-leave-his-mark-on-history.html
Will November’s elections in the US be free and fair?,https://english.elpais.com/opinion/2026-07-13/will-novembers-elections-in-the-united-states-be-free-and-fair.html
José Manuel Restrepo: ‘Colombia is a key ally for the US to achieve its goals in Venezuela’,https://english.elpais.com/international/2026-07-13/jose-manuel-restrepo-colombia-is-an-almost-unconditional-and-key-ally-for-the-us-to-achieve-its-goals-in-venezuela.html
"Omar Sixto, Cuban-American businessman: ‘The solution for Cuba is not an invasion, but a humanitarian takeover’",https://english.elpais.com/international/2026-07-13/omar-sixto-cuban-american-businessman-the-solution-for-cuba-is-not-an-invasion-but-a-humanitarian-takeover-of-the-island.html
The search for missing bodies after Venezuela’s earthquakes: ‘We all deserve closure to this tragedy’,https://english.elpais.com/international/2026-07-13/the-search-for-missing-bodies-after-venezuelas-earthquakes-we-all-deserve-closure-to-this-tragedy.html
Who will win the World Cup? Here are our predictions,https://english.elpais.com/sports/2026-06-17/who-will-win-the-world-cup-here-are-our-predictions.html
Which national soccer teams have the world’s best players?,https://english.elpais.com/sports/2026-06-28/which-national-soccer-teams-have-the-worlds-best-players.html
World Cup spurs Mexican-Americans to reconnect: ‘Putting on the Mexican jersey this time took on a different meaning’,https://english.elpais.com/sports/2026-07-08/world-cup-spurs-mexican-americans-to-reconnect-putting-on-the-mexican-jersey-this-time-took-on-a-different-meaning.html
"The lucrative business of the World Cup: How FIFA secures millions in profits, while host nations take all the risks ",https://english.elpais.com/sports/2026-06-27/the-lucrative-business-of-the-world-cup-how-fifa-secures-millions-in-profits-while-host-nations-take-all-the-risks.html
The FBI investigated writer Carlos Monsiváis over links to the Black Panthers and the Chicano movement,https://english.elpais.com/usa/2026-07-13/the-fbi-investigated-writer-carlos-monsivais-over-links-to-the-black-panthers-and-the-chicano-movement.html
Milei’s insurance revolution: Private policies and agencies to eradicate public services,https://english.elpais.com/international/2026-07-13/mileis-insurance-revolution-private-policies-and-agencies-to-eradicate-public-services.html
A US citizen and El Mencho’s stepson: Washington crowns Juan Carlos Valencia as new leader of the Jalisco New Generation Cartel,https://english.elpais.com/international/2026-07-13/a-us-citizen-and-el-menchos-stepson-washington-crowns-juan-carlos-valencia-as-new-leader-of-the-jalisco-new-generation-cartel.html
South Africa’s anti-immigrant groups move from ultimatums to door-to-door threats,https://english.elpais.com/international/2026-07-13/south-africas-anti-immigrant-groups-move-from-ultimatums-to-door-to-door-threats.html
Tourists still daring to visit besieged Crimea: ‘People tell us we’re crazy’,https://english.elpais.com/international/2026-07-13/tourists-still-daring-to-visit-besieged-crimea-people-tell-us-were-crazy.html
The Joker of San Fermín: A villain at the Running of the Bulls,https://english.elpais.com/spain/2026-07-13/the-joker-of-san-fermin-a-villain-at-the-running-of-the-bulls.html
"Sam Neill, star of ‘Jurassic Park,’ dies at 78",https://english.elpais.com/culture/2026-07-13/sam-neill-star-of-jurassic-park-dies-at-78.html
"Tradition, money, and necessary change: The tennis puzzle still doesn’t quite fit together",https://english.elpais.com/sports/2026-07-13/tradition-money-and-necessary-change-the-tennis-puzzle-still-doesnt-quite-fit-together.html
 Rolling Stones guitarist Ronnie Wood: ‘We’re living in that day and age where we can’t be free with words’,https://english.elpais.com/culture/2026-07-11/rolling-stones-guitarist-ronnie-wood-were-living-in-that-day-and-age-where-we-cant-be-free-with-words.html
The Chinese Communist Party turns 105 amidst technological splendor and Leninist rigor,https://english.elpais.com/international/2026-07-10/the-chinese-communist-party-turns-105-amidst-technological-splendor-and-leninist-rigor.html
The moral catastrophe of Big Tech’s totalitarians-for-profit,https://english.elpais.com/opinion/2026-07-12/they-steal-our-data-they-steal-our-democracy-the-moral-catastrophe-of-big-techs-totalitarians-for-profit.html
"Florianópolis, the Brazilian city that wants to eradicate waste ",https://english.elpais.com/international/2026-07-11/florianopolis-the-brazilian-city-that-wants-to-eradicate-waste.html
"The Andean long-eared mouse, the mammal that holds the key to surviving at more than 22,000 feet",https://english.elpais.com/science-tech/2026-07-10/the-andean-long-eared-mouse-the-mammal-that-holds-the-key-to-surviving-at-altitudes-of-more-than-22000-feet.html
UN takes ‘historic’ step and declares neglected tropical diseases a human rights issue,https://english.elpais.com/international/2026-07-09/un-takes-historic-step-and-declares-neglected-tropical-diseases-a-human-rights-issue.html
From libertarian dream to political weapon: How the far right appropriated the crypto wave,https://english.elpais.com/economy-and-business/2026-07-12/from-libertarian-dream-to-political-weapon-how-the-far-right-appropriated-the-crypto-wave.html
Ireland: A journey to Europe’s wildest economy,https://english.elpais.com/economy-and-business/2026-07-06/a-journey-to-europes-wildest-economy.html
Tech giants lose $2 trillion in SpaceX’s IPO month: ‘The valuations were unsustainable’,https://english.elpais.com/economy-and-business/2026-07-01/tech-giants-lose-2-trillion-in-spacexs-ipo-month-the-valuations-were-unsustainable.html
One dollar a day to clean a detention center: The ‘labor exploitation’ of migrants in ICE jails,https://english.elpais.com/usa/2026-07-10/1-a-day-to-clean-a-detention-center-the-labor-exploitation-of-migrants-in-ice-jails.html
‘Foreign Tongues’ by the Rolling Stones: This never gets old,https://english.elpais.com/opinion/2026-07-10/foreign-tongues-by-the-rolling-stones-this-never-gets-old.html
"At home with Susumu Higa, the anti-war manga artist who does not have a phone or a car",https://english.elpais.com/culture/2026-07-11/at-home-with-susumu-higa-the-anti-war-manga-artist-who-does-not-have-a-phone-or-a-car.html
"‘They offered me 20 liters of semen for a sculpture’: Art, porn and fertility clinics",https://english.elpais.com/culture/2026-07-11/they-offered-me-20-liters-of-semen-for-a-sculpture-art-porn-and-fertility-clinics.html
"‘Music, Fashion, Film’ and the death of ‘Brat’: Charli XCX’s new creative era",https://english.elpais.com/culture/2026-07-09/music-fashion-film-and-the-death-of-brat-charli-xcxs-new-creative-era.html
How an ancient book looted a century ago ended up in the hands of a US magnate,https://english.elpais.com/culture/2026-07-09/how-an-ancient-book-looted-a-century-ago-ended-up-in-the-hands-of-a-us-magnate.html
Why are we so willing to believe the incredible?,https://english.elpais.com/health/2026-07-04/why-are-we-so-willing-to-believe-the-incredible.html
"‘Mom, do you love your phone more than me?’: Children of screen‑absorbed parents are more insecure",https://english.elpais.com/technology/2026-06-24/mom-do-you-love-your-phone-more-than-me-children-of-screenabsorbed-parents-are-more-insecure.html
The rise and fall of millennial icons: From Facebook and Arcade Fire to American Apparel and Buzzfeed  ,https://english.elpais.com/culture/2026-07-04/the-rise-and-fall-of-millennial-icons-from-facebook-and-arcade-fire-to-american-apparel-and-buzzfeed.html
"Naturism in Germany, a long tradition fighting to survive",https://english.elpais.com/culture/2026-06-28/naturism-in-germany-a-long-tradition-fighting-to-survive.html
"All the Jolie-Pitt kids are now adults, and all of them have dropped the ‘Pitt’: the official end of ‘Brangelina’",https://english.elpais.com/people/2026-07-12/all-the-jolie-pitt-kids-are-now-adults-and-all-of-them-have-dropped-the-pitt-the-official-end-of-brangelina.html
Sylvester Stallone battles for his legacy as he turns 80,https://english.elpais.com/culture/2026-07-06/sylvester-stallone-battles-for-his-legacy-as-he-turns-80.html
"The secrets behind Novak Djokovic’s miraculous 39-year-old physique: ‘I work with my body, not against it’",https://english.elpais.com/sports/2026-07-10/the-secrets-behind-novak-djokovics-miraculous-39-year-old-physique-i-work-with-my-body-not-against-it.html
Following the trail of the pilot who delivered El Mayo Zambada to the US,https://english.elpais.com/international/2026-07-09/following-the-trail-of-the-pilot-who-delivered-el-mayo-zambada-to-the-us.html
"Solomy Balungi Bossa, member of the International Criminal Court: ‘Trump views us the same way as terrorists and drug peddlers’ ",https://english.elpais.com/international/2026-07-12/solomy-balungi-bossa-member-of-the-international-criminal-court-trump-views-us-the-same-way-as-terrorists-and-drug-peddlers.html
The clandestine objects of Alligator Alcatraz,https://english.elpais.com/usa/2026-07-11/the-clandestine-objects-of-alligator-alcatraz.html
The world is plunging into a dangerous spiral of military spending,https://english.elpais.com/international/2026-07-12/the-world-is-plunging-into-a-dangerous-spiral-of-military-spending.html
Listen now LOS40 USA,https://los40.us/
EL PAÍS offers free Spanish lessons with Gymglish,https://english.elpais.com/economy-and-business/2021-11-15/el-pais-offers-free-spanish-lessons-with-gymglish.html
"Naureen Shah, ACLU immigration director: ‘This administration’s politics of hate do not represent the views of Americans’ ",https://english.elpais.com/usa/2026-07-09/naureen-shah-aclu-immigration-director-this-administrations-politics-of-hate-do-not-represent-the-views-of-americans.html
The socialists gaining ground in the US as Trump invokes the specter of communism,https://english.elpais.com/usa/2026-07-06/the-socialists-gaining-ground-in-the-us-as-trump-invokes-the-specter-of-communism.html
Ukraine’s biggest defense gap: More than 92% of Russian ballistic missiles hit their targets,https://english.elpais.com/international/2026-07-12/ukraines-biggest-defense-gap-more-than-92-of-russian-ballistic-missiles-hit-their-targets.html
Spain’s Supreme Court sentences former Socialist minister Ábalos to 24 years behind bars,https://english.elpais.com/spain/2026-06-22/spains-supreme-court-sentences-former-socialist-minister-abalos-to-24-years-behind-bars.html
Abelardo de la Espriella embraces Trump's 'Donroe doctrine' as it spreads across Latin America,https://english.elpais.com/international/2026-07-12/abelardo-de-la-espriella-embraces-trumps-donroe-doctrine-as-it-spreads-across-latin-america.html
The children of Brazil’s asylum of horror demand justice: ‘It was a lifetime punishment’,https://english.elpais.com/international/2026-07-06/the-children-of-brazils-asylum-of-horror-demand-justice-it-was-a-lifetime-punishment.html
"Gold falls below $4,000 an ounce for the first time since November",https://english.elpais.com/economy-and-business/2026-06-25/gold-falls-below-4000-an-ounce-for-the-first-time-since-november.html
An economic paradox: When savings are both a good and a bad idea,https://english.elpais.com/economy-and-business/2026-06-29/makhtar-diop-head-of-the-ifc-the-world-banks-financial-arm-we-want-to-use-madrid-to-channel-more-private-investment-to-emerging-markets.html
"Danny Elfman, Hollywood’s macabre musician: ‘I don’t know how young composers coming up now are going to survive’",https://english.elpais.com/culture/2026-07-06/danny-elfman-hollywoods-macabre-musician-i-dont-know-how-young-composers-coming-up-now-are-going-to-survive.html
Madonna: The woman who invented the manual for resistance ,https://english.elpais.com/culture/2026-07-02/madonna-the-woman-who-invented-the-manual-for-resistance.html
The female science influencers who leverage their training and have legions of followers,https://english.elpais.com/science-tech/2026-07-02/the-female-science-influencers-who-leverage-their-training-and-have-legions-of-followers.html
What’s the best way to talk about health with chatbots?,https://english.elpais.com/technology/2026-04-25/whats-the-best-way-to-talk-about-health-with-chatbots.html
"Mexico’s Generation Z is growing up with precariousness, uncertainty and political distrust",https://english.elpais.com/lifestyle/2026-02-22/welcome-to-rbald-providing-an-online-safe-space-for-receding-hairlines-for-over-15-years.html
From January euphoria to February despair: Why most of our New Year’s resolutions fail,https://english.elpais.com/lifestyle/2026-02-21/from-january-euphoria-to-february-despair-why-most-of-our-new-years-resolutions-fail.html
Dodgers give $1.1 million to support families affected by LA migrant raids,https://english.elpais.com/usa/2026-06-25/the-dodgers-give-11-million-to-support-families-affected-by-immigration-raids-in-los-angeles.html
"Folarin Balogun, the US striker who wouldn’t be American if it were up to Trump",https://english.elpais.com/usa/2026-06-24/folarin-balogun-the-us-striker-who-wouldnt-be-american-if-it-were-up-to-trump.html
