headline,url
Tehran denies Washington’s claims of agreement to extend Iran war ceasefire,https://english.elpais.com/international/2026-05-29/tehran-denies-us-claims-of-extension-to-iran-war-ceasefire.html
Gustavo Petro to travel to New York to meet Mayor Zohran Mamdani,https://english.elpais.com/international/2026-05-29/gustavo-petro-to-travel-to-new-york-to-meet-mayor-zohran-mamdani.html
Shortage of troops in Ukraine reopens debate on recruiting women,https://english.elpais.com/international/2026-05-29/shortage-of-troops-in-ukraine-reopens-debate-on-recruiting-women.html
González Iñárritu: ‘I know US culture. They don’t know a damn thing about Mexican culture’,https://english.elpais.com/culture/2026-05-29/alejandro-gonzalez-inarritu-i-know-about-us-culture-they-dont-know-a-damn-thing-about-mexican-culture.html
US designates two Brazilian criminal gangs as terrorist organizations,https://english.elpais.com/international/2026-05-29/united-states-designates-two-brazilian-criminal-gangs-as-terrorist-organizations.html
"Simone Biles: ‘I hate exercise; after doing it for so long, I deserve a break’",https://english.elpais.com/sports/2026-05-29/simone-biles-i-hate-exercise-after-doing-it-for-so-long-i-deserve-a-break.html
‘Lawyer of miracles’ Alexandra Lozano brought down over allegations of scamming migrants,https://english.elpais.com/usa/2026-05-29/lawyer-of-miracles-alexandra-lozano-brought-down-over-allegations-of-fabricating-abuse-claims-and-scamming-migrants.html
Festival marking America’s 250th anniversary faces exodus of artists due to event’s ties to Trump,https://english.elpais.com/usa/2026-05-29/festival-marking-americas-250th-anniversary-faces-exodus-of-artists-due-to-events-ties-to-trump.html
"Rubén Gallego, Democratic senator: ‘Marco Rubio is obsessed with Cuba, but it is not a threat to the US’",https://english.elpais.com/usa/2026-05-29/ruben-gallego-democratic-senator-marco-rubio-is-obsessed-with-cuba-but-it-is-not-a-threat-to-the-us.html
Republican lawmakers push for education reform inspired by Charlie Kirk,https://english.elpais.com/usa/2026-05-28/religion-gender-and-diversity-republican-lawmakers-are-pushing-for-education-reform-proposals-inspired-by-charlie-kirk.html
Trump’s corruption,https://english.elpais.com/opinion/2026-05-29/trumps-corruption.html
Cities paved with concrete: filmmaker John Wilson delves into the cracks of capitalism,https://english.elpais.com/culture/2026-05-29/cities-paved-with-concrete-filmmaker-john-wilson-delves-into-the-cracks-of-capitalism.html
Blood test can detect early symptoms 10 years before onset of Alzheimer’s,https://english.elpais.com/health/2026-05-29/blood-test-can-detect-early-symptoms-10-years-before-onset-of-alzheimers.html
Sleep-better tech: apps and devices that actually work,https://english.elpais.com/health/2026-05-29/sleep-better-tech-apps-and-devices-that-actually-work.html
The adult tribe that is transforming Disney: ‘Everything outside ceases to exist’,https://english.elpais.com/culture/2026-05-29/the-adult-tribe-that-is-transforming-disney-everything-outside-ceases-to-exist.html
A podcast against obscurity: Radio Venceremos once again defies the silence in El Salvador ,https://english.elpais.com/international/2026-05-28/a-podcast-against-obscurity-radio-venceremos-once-again-defies-the-silence-in-el-salvador.html
"Winette Van der Graaf, oncologist: ‘I never would have imagined seeing patients with colorectal cancer at age 19′",https://english.elpais.com/health/2026-05-27/winette-van-der-graaf-oncologist-i-never-would-have-imagined-seeing-patients-with-colorectal-cancer-at-age-19.html
How the Pope came to say that ‘AI needs to be be disarmed’,https://english.elpais.com/technology/2026-05-26/a-franciscan-monk-a-festival-with-karol-g-and-the-vaticans-investments-how-the-pope-came-to-say-that-ai-needs-to-be-be-disarmed.html
"Raquel Chan, the Argentine scientist who created drought-tolerant seeds: ‘GMOs have become a dirty word’",https://english.elpais.com/science-tech/2026-05-26/raquel-chan-the-renowned-argentine-scientist-who-created-drought-tolerant-seeds-gmos-have-become-a-dirty-word.html
Longevity researcher Juan Carlos Izpisua: ‘Aging is a loss of identity at the cellular level’,https://english.elpais.com/science-tech/2026-05-25/longevity-researcher-juan-carlos-izpisua-presents-latest-data-on-aging-process-it-is-a-loss-of-identity-at-the-cellular-level.html
"SpaceX, OpenAI and Anthropic IPOs threaten to drive Wall Street to bubble-like levels",https://english.elpais.com/economy-and-business/2026-05-28/the-ipos-of-spacex-openai-and-anthropic-threaten-to-drive-wall-street-to-bubble-like-levels.html
"Spaniards work half an hour more per week than the European average, and four more than the Dutch",https://english.elpais.com/economy-and-business/2026-05-28/spaniards-work-half-an-hour-more-per-week-than-the-european-average-and-four-more-than-the-dutch.html
"Heidi O’Neill, the Nike veteran who knows how to turn around a struggling business",https://english.elpais.com/economy-and-business/2026-05-26/heidi-oneill-the-nike-veteran-who-knows-how-to-turn-around-a-struggling-business.html
Spain joins list of more than 30 countries that have banned Polymarket,https://english.elpais.com/technology/2026-05-27/spain-joins-list-of-more-than-30-countries-that-have-banned-polymarket.html
"The contradiction of AI in cinema: Creators fear it, but the market and the industry embrace it",https://english.elpais.com/culture/2026-05-27/the-contradiction-of-ai-in-cinema-creators-fear-it-but-the-market-and-the-industry-embrace-it.html
"Miles Davis, a century of jazz’s great alchemist",https://english.elpais.com/culture/2026-05-26/miles-davis-a-century-of-jazzs-great-alchemist.html
"‘México ’86,’ a satire about the inner workings of a World Cup, complete with a scheme to deceive FIFA",https://english.elpais.com/culture/2026-05-26/mexico-86-a-satire-about-the-inner-workings-of-a-world-cup-complete-with-a-scheme-to-deceive-fifa.html
Spider-Noir: A Spider-Man with Nicolas Cage’s face that is ‘70% Humphrey Bogart and 30% Bugs Bunny’,https://english.elpais.com/culture/2026-05-27/spider-noir-a-spider-man-with-nicolas-cages-face-that-is-70-humphrey-bogart-and-30-bugs-bunny.html
"Camila Morrone takes center stage, free from her past relationship with Leonardo DiCaprio",https://english.elpais.com/people/2026-05-28/camila-morrone-takes-center-stage-free-from-the-shadow-of-her-past-relationship-with-leonardo-dicaprio.html
Does showering in the dark help improve sleep? Here’s what the science says,https://english.elpais.com/lifestyle/2026-05-07/does-showering-in-the-dark-help-improve-sleep-heres-what-the-science-says.html
Dancing cows and tigers hatching from eggs: The impact of AI-generated videos on children,https://english.elpais.com/technology/2026-05-12/dancing-cows-and-tigers-hatching-from-eggs-the-impact-of-ai-generated-videos-on-children.html
Why do luxury hotels smell so good?,https://english.elpais.com/lifestyle/2026-05-10/why-do-luxury-hotels-smell-so-good.html
False memories: Why our mind reconstructs the past,https://english.elpais.com/lifestyle/2026-05-21/false-memories-why-our-mind-reconstructs-the-past.html
"Anne Hathaway, Martin Scorsese, Charlie XCX... Hollywood lands on Letterboxd: An impossible romance?",https://english.elpais.com/culture/2026-05-23/anne-hathaway-martin-scorsese-charlie-xcx-hollywood-lands-on-letterboxd-an-impossible-romance.html
"Once booed at Cannes as ‘frivolous’, it’s now clear that ‘Marie Antoinette’ foresaw the rise of the influencer",https://english.elpais.com/culture/2026-05-27/once-booed-at-cannes-as-frivolous-its-now-clear-that-marie-antoinette-foresaw-the-rise-of-the-influencer.html
The Julio César Chávez family: Mexico’s most famous boxing dynasty faces a different kind of fight,https://english.elpais.com/international/2026-05-25/the-julio-cesar-chavez-family-mexicos-most-famous-boxing-dynasty-faces-a-different-kind-of-fight.html
Roberto Velasco: ‘Mexico’s sovereignty is the first thing that must always be defended’,https://english.elpais.com/international/2026-05-27/roberto-velasco-mexicos-sovereignty-is-the-first-thing-that-must-always-be-defended.html
"A bittersweet year for Afrikaners, the only refugees admitted by Trump",https://english.elpais.com/international/2026-05-24/a-bittersweet-year-for-afrikaners-the-only-refugees-admitted-by-trump.html
"José Javier Rodríguez, the Cuban‑American Democrat seeking to rescue the Florida attorney general’s office from Trumpism ",https://english.elpais.com/usa/2026-05-27/jose-javier-rodriguez-the-cubanamerican-democrat-seeking-to-rescue-the-florida-attorney-generals-office-from-trumpism.html
NUEVAYoL: The Puerto Rican New York that Bad Bunny sings about,https://english.elpais.com/eps/2026-05-24/nuevayol-the-puerto-rican-new-york-that-bad-bunny-sings-about.html
Listen now LOS40 USA,https://los40.us/
EL PAÍS offers free Spanish lessons with Gymglish,https://english.elpais.com/economy-and-business/2021-11-15/el-pais-offers-free-spanish-lessons-with-gymglish.html
The battle to redraw electoral districts ahead of the midterms: Where changes have been confirmed and where they are awaiting approval ,https://english.elpais.com/usa/2026-05-27/the-battle-to-redraw-electoral-districts-ahead-of-the-midterms-where-changes-have-been-confirmed-and-where-they-are-awaiting-approval.html
ICE expands use of iris scanners in its operations through a multi-million-dollar contract,https://english.elpais.com/usa/2026-05-27/ice-expands-use-of-iris-scanners-in-its-operations-through-a-multi-million-dollar-contract.html
"Iran’s frozen assets, the last major stumbling block in negotiations with Washington",https://english.elpais.com/international/2026-05-26/irans-frozen-assets-the-last-major-stumbling-block-in-negotiations-with-washington.html
Trump receives Flávio Bolsonaro in the Oval Office three weeks after Lula,https://english.elpais.com/international/2026-05-27/trump-receives-flavio-bolsonaro-in-the-oval-office-three-weeks-after-lula.html
University demands against Argentina’s Milei escalate with student protests and faculty strikes ,https://english.elpais.com/international/2026-05-28/university-demands-against-argentinas-milei-escalate-with-student-protests-and-faculty-strikes.html
Sheinbaum’s approval ratings drop seven points after Sinaloa and Chihuahua crises,https://english.elpais.com/international/2026-05-27/sheinbaums-approval-ratings-drop-seven-points-after-sinaloa-and-chihuahua-crises.html
Milei pushes through a labor reform that Argentina resisted under previous right‑wing governments  ,https://english.elpais.com/international/2026-02-23/milei-pushes-through-a-labor-reform-that-argentina-resisted-under-previous-rightwing-governments.html
An economic paradox: When savings are both a good and a bad idea,https://english.elpais.com/economy-and-business/2026-05-11/draculas-castle-is-bought-by-us-entrepreneur-in-charge-of-elvis-presleys-estate.html
What would happen if a tradwife woke up in 1855?  ,https://english.elpais.com/culture/2026-05-22/what-would-happen-if-a-tradwife-woke-up-in-1855.html
"Lena Dunham, the millennial icon who changed the way the body and sex are portrayed",https://english.elpais.com/culture/2026-05-19/lena-dunham-the-millennial-icon-who-changed-the-way-the-body-and-sex-are-portrayed.html
Generational rejection of AI? Why are university students booing big tech at graduation ceremonies?,https://english.elpais.com/technology/2026-05-19/generational-rejection-of-ai-why-are-university-students-booing-big-tech-at-graduation-ceremonies.html
What’s the best way to talk about health with chatbots?,https://english.elpais.com/technology/2026-04-25/whats-the-best-way-to-talk-about-health-with-chatbots.html
"Mexico’s Generation Z is growing up with precariousness, uncertainty and political distrust",https://english.elpais.com/lifestyle/2026-02-22/welcome-to-rbald-providing-an-online-safe-space-for-receding-hairlines-for-over-15-years.html
From January euphoria to February despair: Why most of our New Year’s resolutions fail,https://english.elpais.com/lifestyle/2026-02-21/from-january-euphoria-to-february-despair-why-most-of-our-new-years-resolutions-fail.html
Maradona’s lawyer and two of his sisters to stand trial over ‘undue profit’ from his trademarks,https://english.elpais.com/international/2026-04-29/maradonas-lawyer-and-two-of-his-sisters-to-stand-trial-over-undue-profit-from-his-trademarks.html
Faustino Oro: The second-youngest chess grandmaster in history,https://english.elpais.com/sports/2026-05-11/faustino-oro-the-second-youngest-chess-grandmaster-in-history.html
