headline,url
Trump plunges the US economy into chaos and uncertainty,https://english.elpais.com/economy-and-business/2025-06-02/trump-plunges-the-us-economy-into-chaos-and-uncertainty.html
Bukele: ‘I don’t care if they call me dictator. Better than seeing Salvadorans killed on the streets’,https://english.elpais.com/international/2025-06-02/bukele-i-dont-care-if-they-call-me-dictator-better-than-seeing-salvadorans-killed-on-the-streets.html
Mexico’s first judicial elections draw only 13% of eligible voters,https://english.elpais.com/international/2025-06-02/mexicos-first-judicial-elections-draw-only-13-of-eligible-voters.html
Searching for food in Gaza turns into a deadly race among flying bullets,https://english.elpais.com/international/2025-06-02/searching-for-food-in-gaza-turns-into-a-deadly-race-among-flying-bullets.html
More active than usual hurricane season kicks off amid threat of US aid cuts,https://english.elpais.com/climate/2025-06-02/a-more-active-than-average-hurricane-season-begins-under-the-threat-of-us-aid-cuts.html
‘The dream of studying in the United States has turned into a nightmare’,https://english.elpais.com/usa/2025-06-02/the-dream-of-studying-in-the-united-states-has-turned-into-a-nightmare.html
"Barrio Obrero, the Dominican heart of Puerto Rico, is torn apart by ICE raids: ‘It’s a city under siege’",https://english.elpais.com/usa/2025-06-01/barrio-obrero-the-dominican-heart-of-puerto-rico-is-torn-apart-by-ice-raids-its-a-city-under-siege.html
"Barbara F. Walter, civil conflict expert: ‘I see Trump provoking a foreign war to force a third term’  ",https://english.elpais.com/usa/2025-06-01/barbara-f-walter-civil-conflict-expert-i-see-trump-provoking-a-foreign-war-to-force-a-third-term.html
"Puerto Ricans denounce that American tourists are trying to ‘silence’ the song of the coquí, the island’s endangered frog",https://english.elpais.com/climate/2025-06-01/puerto-ricans-denounce-that-american-tourists-are-trying-to-silence-the-song-of-the-coqui-the-islands-endemic-and-endangered-frog.html
"Matthew Desmond, sociologist: ‘We should ask ourselves if the companies we give our money to are exploiting their workers’ ",https://english.elpais.com/usa/2025-06-01/matthew-desmond-sociologist-we-should-ask-ourselves-if-the-companies-we-give-our-money-to-are-exploiting-their-workers.html
The shaky foundations of Alexandria are being eroded by climate crisis ,https://english.elpais.com/climate/2025-06-01/the-shaky-foundations-of-alexandria-are-being-eroded-by-climate-crisis.html
"Fenix, a new Rotterdam museum that explores immigration through art ",https://english.elpais.com/culture/2025-06-01/fenix-a-new-rotterdam-museum-that-explores-immigration-through-art.html
‘Eight legs is too many legs!’: Why spiders have reigned supreme in horror films for 70 years,https://english.elpais.com/culture/2025-06-01/eight-legs-is-too-many-legs-why-spiders-have-reigned-supreme-in-horror-films-for-70-years.html
Ayo Edebiri: ‘I’ve told my parents to get copies of all their documents. That’s not something that I would have ever wished’,https://english.elpais.com/culture/2025-06-01/ayo-edebiri-ive-told-my-parents-to-get-copies-of-all-their-documents-thats-not-something-that-i-would-have-ever-wished.html
"Montgat, the Spanish town stripped of beaches and income  ",https://english.elpais.com/lifestyle/2025-06-01/montgat-the-spanish-town-stripped-of-beaches-and-income.html
Going to an office and pretending to work: A business that’s booming in China,https://english.elpais.com/international/2025-05-31/going-to-an-office-and-pretending-to-work-a-business-thats-booming-in-china.html
Most lethal bacterium of all time became less virulent in order to keep killing millions,https://english.elpais.com/science-tech/2025-05-30/most-lethal-bacterium-of-all-time-became-less-virulent-in-order-to-keep-killing-millions.html
Ant bridges and bird-built pergolas: What animal architecture teaches us about evolution ,https://english.elpais.com/science-tech/2025-05-31/ant-bridges-and-bird-built-pergolas-what-animal-architecture-teaches-us-about-evolution.html
The grim fate of the museum dedicated to the world’s most unfortunate people,https://english.elpais.com/science-tech/2025-05-29/the-grim-fate-of-the-museum-dedicated-to-the-worlds-most-unfortunate-people.html
Leprosy spread throughout America centuries before the arrival of Europeans,https://english.elpais.com/science-tech/2025-05-30/leprosy-spread-throughout-america-centuries-before-the-arrival-of-europeans.html
A robotic arm made from human tissue: Science advances toward living muscle prosthetics,https://english.elpais.com/science-tech/2025-05-30/a-robotic-arm-made-from-human-tissue-science-advances-toward-living-muscle-prosthetics.html
Trump breaks all the negotiation manuals,https://english.elpais.com/economy-and-business/2025-05-28/trump-breaks-all-the-negotiation-manuals.html
Spanish tourism to the US grew in first four months of 2025,https://english.elpais.com/economy-and-business/2025-05-28/spanish-tourism-to-the-us-grew-in-first-four-months-of-2025.html
"He Lifeng, the trusted aide to Xi Jinping who broke the trade deadlock",https://english.elpais.com/economy-and-business/2025-05-19/he-lifeng-the-trusted-aide-to-xi-jinping-who-broke-the-trade-deadlock.html
The 3.5% tax on remittances: A blow of over $2.7 billion for undocumented Mexican migrants,https://english.elpais.com/economy-and-business/2025-05-26/the-35-tax-on-remittances-a-blow-of-over-27-billion-for-undocumented-mexican-migrants.html
Vincent Bevins: ‘The elites have discovered they can govern us without legitimacy’,https://english.elpais.com/culture/2025-05-31/vincent-bevins-the-elites-have-discovered-they-can-govern-us-without-legitimacy.html
"Gloria Estefan: ‘I have faith in the United States, but we must be careful’",https://english.elpais.com/culture/2025-05-29/gloria-estefan-i-have-faith-in-the-united-states-but-we-must-be-careful-democracy-is-a-living-thing-and-it-can-die.html
Wendy Guerra: ‘This book touches on very serious wounds about Cuba’,https://english.elpais.com/culture/2025-05-28/wendy-guerra-this-book-touches-on-very-serious-wounds-about-cuba-and-in-its-language-never-has-one-of-my-novels-been-so-cuban.html
"The filming of Robin Williams’ ‘Popeye,’ where cocaine was hidden in walkie-talkies: ‘You couldn’t escape it’",https://english.elpais.com/culture/2025-05-27/the-filming-of-robin-williams-popeye-where-cocaine-was-hidden-in-walkie-talkies-you-couldnt-escape-it.html
Karla Sofía Gascón plays the villain in new western ‘Trinidad’,https://english.elpais.com/culture/2025-05-28/karla-sofia-gascon-plays-the-villain-in-new-western-trinidad.html
Yevonde Middleton: The photographer who transformed aristocrats into Greek goddesses,https://english.elpais.com/culture/2025-05-31/yevonde-middleton-the-photographer-who-transformed-english-aristocrats-into-greek-goddesses-in-1935.html
How to make Enrique Olvera’s five favorite tacos ,https://english.elpais.com/lifestyle/2025-05-31/how-to-make-enrique-olveras-five-favorite-tacos.html
"US entrepreneur buys abandoned village in Spain, hoping to turn it into a tourist magnet where others have failed",https://english.elpais.com/international/2025-05-27/us-entrepreneur-buys-abandoned-village-in-spain-hoping-to-turn-it-into-a-tourist-magnet-where-others-have-failed.html
"Food Runners, the dating app alternative: Run, eat, meet someone new",https://english.elpais.com/lifestyle/2025-05-12/food-runners-the-dating-app-alternative-run-eat-meet-someone-new.html
Brazil’s sustainable agriculture formula to combat deforestation and generate more income,https://english.elpais.com/climate/2025-05-31/brazils-sustainable-agriculture-formula-to-combat-deforestation-and-generate-more-income.html
"Janet Jackson’s 50 years in music, carrying the weight of her famous family name ",https://english.elpais.com/culture/2025-05-26/janet-jacksons-50-years-in-music-carrying-the-weight-of-her-famous-family-name.html
John Travolta and the worst movie of all time: What happened on the set of ‘Battlefield Earth’?,https://english.elpais.com/culture/2025-05-29/john-travolta-and-the-worst-movie-of-all-time-what-happened-on-the-set-of-battlefield-earth.html
Orwell was right: The dystopia of ‘1984’ is already here,https://english.elpais.com/culture/2025-05-26/orwell-was-right-the-dystopia-of-1984-is-already-here.html
"Meet MrBeast, the controversial YouTuber with millions of followers",https://english.elpais.com/people/2025-05-24/meet-mrbeast-the-controversial-youtuber-with-millions-of-followers.html
"John Bolton, Trump’s former national security adviser: ‘What he wants is the Nobel Peace Prize’",https://english.elpais.com/usa/2025-05-31/john-bolton-trumps-former-national-security-adviser-what-he-wants-is-the-nobel-peace-prize.html
The deportation of Sofia: A family’s battle against Trump’s cruelty towards a sick little girl from Mexico,https://english.elpais.com/usa/2025-05-31/the-deportation-of-sofia-a-familys-battle-against-trumps-cruelty-towards-a-sick-little-girl-from-mexico.html
The trailblazing trans miner of Patagonia: ‘I hacked the system. I set a precedent. We changed history’,https://english.elpais.com/eps/2025-05-30/the-trailblazing-trans-miner-of-patagonia-i-hacked-the-system-i-set-a-precedent-we-changed-history.html
"A date at Richard Gere’s house: ‘Life isn’t about money or power, but about love and affection’",https://english.elpais.com/eps/2025-05-28/a-date-at-richard-geres-house-life-isnt-about-money-or-power-but-about-love-and-affection.html
Listen now LOS40 USA,https://los40.us/
Billie Eilish Adds New Dates to Hit Me Hard and Soft Tour,https://los40.us/2025/billie-eilish-adds-new-dates-to-hit-me-hard-and-soft-tour-34020.html
"Luis de Javier, the Designer Who’s Dressed Celebrities Like Lady Gaga and Beyoncé: “I’m Inspired by Women Who Don’t Take No for an Answer”",https://los40.us/2025/luis-de-javier-the-hispanic-designer-whos-dressed-lady-gaga-beyonce-and-rosalia-im-inspired-by-working-women-who-dont-take-no-for-an-answer-34025.html
EL PAÍS offers free Spanish lessons with Gymglish,https://english.elpais.com/economy-and-business/2021-11-15/el-pais-offers-free-spanish-lessons-with-gymglish.html
"Supreme Court lets Trump end humanitarian parole for 500,000 migrants",https://english.elpais.com/usa/2025-05-30/supreme-court-lets-trump-end-humanitarian-parole-for-500000-migrants.html
Half a million ‘Dreamers’ fear deportation: ‘Now I’m really more afraid’ ,https://english.elpais.com/usa/2025-05-30/half-a-million-dreamers-fear-deportation-now-im-really-more-afraid.html
Israel forces thousands of Gazans to travel tens of miles to access aid,https://english.elpais.com/international/2025-05-30/israel-forces-thousands-of-gazans-to-travel-tens-of-miles-to-access-aid.html
"From the Sahel to Myanmar, Moscow military forum strengthens Kremlin’s networks in Africa and Asia ",https://english.elpais.com/international/2025-05-28/from-the-sahel-to-myanmar-moscow-military-forum-strengthens-kremlins-networks-in-africa-and-asia.html
Colombian migration shifts southward amid Trump’s hardline policies and new barriers in the EU,https://english.elpais.com/international/2025-05-31/colombian-migration-shifts-southward-amid-trumps-hardline-policies-and-new-barriers-in-the-eu.html
Venezuela kicks off its most uncertain presidential campaign,https://english.elpais.com/international/2025-05-30/a-vacant-lot-one-survivor-and-a-short-path-to-death-for-the-mexican-band-grupo-fugitivo.html
Hyperconnectivity and holographic calls: Telecoms race to meet growing demands,https://english.elpais.com/technology/2025-05-24/hyperconnectivity-and-holographic-calls-telecoms-race-to-meet-growing-demands.html
An economic paradox: When savings are both a good and a bad idea,https://english.elpais.com/economy-and-business/2025-05-19/he-lifeng-the-trusted-aide-to-xi-jinping-who-broke-the-trade-deadlock.html
"Slavoj Žižek, philosopher: ‘Wisdom is what I hate most, it is absolute conformist stupidity’",https://english.elpais.com/culture/2025-05-25/slavoj-zizek-philosopher-wisdom-is-what-i-hate-most-it-is-absolute-conformist-stupidity.html
Spike Lee: ‘I don’t know how we can talk about American values considering who the president is’,https://english.elpais.com/culture/2025-05-25/spike-lee-i-dont-know-how-we-can-talk-about-american-values-considering-who-the-president-is.html
Experimental drug fights lung cancer in nonsmokers: ‘I feel like I did when I was healthy’,https://english.elpais.com/health/2025-05-28/experimental-drug-fights-lung-cancer-in-nonsmokers-i-feel-like-i-did-when-i-was-healthy.html
Should we wipe out the pests now that we can?,https://english.elpais.com/science-tech/2025-05-26/should-we-wipe-out-the-pests-now-that-we-can.html
Welcome to the ‘antisocial century’: Are we lonelier now than ever?,https://english.elpais.com/lifestyle/2025-05-03/welcome-to-the-antisocial-century-are-we-lonelier-now-than-ever.html
‘Recession blonde’: The trendy style that says more about your finances than about your hair,https://english.elpais.com/lifestyle/2025-04-29/recession-blonde-the-trendy-style-that-says-more-about-your-finances-than-your-hair.html
Mexico’s ‘lucha libre’ makes the leap into American entertainment: Cultural appropriation or an opportunity for growth?,https://english.elpais.com/sports/2025-05-19/mexicos-lucha-libre-makes-the-leap-into-american-entertainment-cultural-appropriation-or-an-opportunity-for-growth.html
"Climbing without a rope, between freedom and psychopathy",https://english.elpais.com/eps/2025-05-18/rodri-soccers-most-anticipated-return.html
