headline,url
"Harris and Trump in North Carolina: Two rallies, two parallel universes",https://english.elpais.com/usa/elections/2024-11-04/harris-and-trump-in-north-carolina-two-rallies-two-parallel-universes.html
Donald Trump’s lies about Haitians raise racial tensions in Springfield,https://english.elpais.com/usa/elections/2024-11-04/donald-trumps-lies-about-haitians-raise-racial-tensions-in-springfield.html
The battle for Congress is as close as the fight for the White House,https://english.elpais.com/usa/elections/2024-11-04/the-battle-for-congress-is-as-close-as-the-fight-for-the-white-house.html
The election will be televised: 70 years of TV ads for US voters  ,https://english.elpais.com/usa/elections/2024-11-02/the-election-will-be-televised-70-years-of-tv-ads-for-us-voters.html
Fontaines DC’s bid to shape the future of rock   ,https://english.elpais.com/culture/2024-11-03/fontaines-dcs-bid-to-shape-the-future-of-rock.html
Living on a boat because you can’t pay the rent: ‘I have a decent life here’,https://english.elpais.com/economy-and-business/2024-11-02/living-on-a-boat-because-you-cant-pay-the-rent-i-have-a-decent-life-here.html
"Spanish royals’ visit to flood-hit town was the king’s idea, despite warnings about angry crowds",https://english.elpais.com/climate/2024-11-04/spanish-royals-visit-to-flood-hit-town-was-the-kings-idea-despite-warnings-about-angry-crowds.html
"Garages and tunnels, the unknown factor in the search for more victims of Spanish floods",https://english.elpais.com/climate/2024-11-04/garages-and-tunnels-the-unknown-factor-in-the-search-for-more-victims-of-spanish-floods.html
A visual guide to understanding the deadly floods in Spain,https://english.elpais.com/climate/2024-11-01/a-visual-guide-to-understanding-the-deadly-floods-in-spain.html
Joseph Nye: ‘Trump could destroy the United States’ soft power’,https://english.elpais.com/usa/elections/2024-11-03/joseph-nye-trump-could-destroy-the-united-states-soft-power.html
Lies about immigration beyond the border: A journey through the crucial state of Wisconsin,https://english.elpais.com/usa/elections/2024-11-03/lies-about-immigration-beyond-the-border-a-journey-through-the-crucial-state-of-wisconsin.html
"Arab-American voters: A diverse, complex community disappointed with Biden and Harris",https://english.elpais.com/usa/elections/2024-11-02/arab-american-voters-a-diverse-complex-community-disappointed-with-biden-and-harris.html
Forbidden luxury enters Russia from the south,https://english.elpais.com/international/2024-11-03/forbidden-luxury-enters-russia-from-the-south.html
"Pepón Osorio, the artist who seeks to redefine convalescence for minorities in the United States",https://english.elpais.com/culture/2024-11-02/pepon-osorio-the-artist-who-seeks-to-redefine-convalescence-for-minorities-in-the-united-states.html
The paradox of non-transparent drug prices: Why governments do the opposite of what they say ,https://english.elpais.com/health/2024-11-03/the-paradox-of-non-transparent-drug-prices-why-governments-do-the-opposite-of-what-they-say.html
‘A devastating cocktail for the face’: Is Ozempic aging us prematurely?  ,https://english.elpais.com/lifestyle/2024-11-02/a-devastating-cocktail-for-the-face-is-ozempic-aging-us-prematurely.html
"Susana Draper, Princeton professor: ‘The calling out of aggressors on social media often reproduces the tics of the punitive system’  ",https://english.elpais.com/culture/2024-11-03/susana-draper-princeton-professor-the-calling-out-of-aggressors-on-social-media-often-reproduces-the-tics-of-the-punitive-system.html
Largest cancer atlas to date brings new treatments for incurable tumors closer,https://english.elpais.com/science-tech/2024-10-30/largest-cancer-atlas-to-date-brings-new-treatments-for-incurable-tumors-closer.html
Research reveals hidden antibiotics in non-immune proteins,https://english.elpais.com/science-tech/2024-10-29/research-reveals-hidden-antibiotics-in-non-immune-proteins.html
"Humans are already repeating words learned from ChatGPT, such as ‘delve’ and ‘meticulous’",https://english.elpais.com/technology/2024-10-24/humans-are-already-repeating-words-learned-from-chatgpt-such-as-delve-and-meticulous.html
A chain of Mars exploration catastrophes: When NASA confused the metric with the imperial system,https://english.elpais.com/science-tech/2024-10-27/a-chain-of-mars-exploration-catastrophes-when-nasa-confused-the-metric-with-the-imperial-system.html
Repeated bullying can affect 49 brain regions,https://english.elpais.com/health/2024-10-29/repeated-bullying-can-affect-49-brain-regions.html
LinkedIn shoots for TikTok’s virality ,https://english.elpais.com/technology/2024-10-27/linkedin-shoots-for-tiktoks-virality.html
Why seven out of 10 entrepreneurial ideas fail,https://english.elpais.com/economy-and-business/2024-10-26/why-seven-out-of-10-entrepreneurial-ideas-fail.html
"Shein’s strategy for Europe and US: ‘We only make 200 copies of a garment. If it’s successful, we mass produce it’",https://english.elpais.com/economy-and-business/2024-10-24/sheins-strategy-for-europe-and-the-us-we-only-make-200-copies-of-a-garment-if-its-successful-we-mass-produce-it.html
Is it Trumpist to drive a Tesla? Political polarization hits the brand,https://english.elpais.com/usa/elections/2024-10-25/is-it-trumpist-to-drive-a-tesla-political-polarization-hits-the-brand.html
"Flow States, the triennial that redefines Latinx art and its global history",https://english.elpais.com/culture/2024-11-02/flow-states-the-triennial-that-redefines-latinx-art-and-its-global-history.html
"Valeriana, the ancient Mayan city found thanks to laser imaging",https://english.elpais.com/culture/2024-10-30/valeriana-the-ancient-mayan-city-found-thanks-to-laser-imaging.html
How Lovecraft found new fans thanks to a terrifying role-playing game,https://english.elpais.com/culture/2024-10-31/how-lovecraft-found-new-fans-thanks-to-a-terrifying-role-playing-game.html
The questions surrounding the Chopin waltz unearthed in a New York library,https://english.elpais.com/culture/2024-10-30/the-questions-surrounding-the-chopin-waltz-unearthed-in-a-new-york-library.html
"Sean Baker, the director of the dark side of the American dream: ‘I think I show an America that you would otherwise never see on the big screen’",https://english.elpais.com/culture/2024-10-28/sean-baker-the-director-of-the-dark-side-of-the-american-dream-i-think-i-show-an-america-that-you-would-otherwise-never-see-on-the-big-screen.html
Excited or exhausted: Why no one has a normal relationship with work anymore,https://english.elpais.com/culture/2024-10-28/the-secret-of-the-best-pizza-in-the-world-is-in-new-york.html
"Hiding partners from social media: Dramatic, strategic or a sign of freedom?  ",https://english.elpais.com/lifestyle/2024-10-26/hiding-partners-from-social-media-dramatic-strategic-or-a-sign-of-freedom.html
A ‘don’t text your ex’ shirt and divorce rings: Fashion leads a break-up paradigm shift,https://english.elpais.com/lifestyle/2024-10-25/a-dont-text-your-ex-shirt-and-divorce-rings-fashion-leads-a-break-up-paradigm-shift.html
Why sexy costumes are so popular among women on Halloween,https://english.elpais.com/society/2024-10-30/why-sexy-costumes-are-so-popular-among-women-on-halloween.html
One year without Matthew Perry: The shocking death that continues to raise questions,https://english.elpais.com/people/2024-10-28/one-year-without-matthew-perry-the-shocking-death-that-continues-to-raise-questions.html
"From a cult to Hollywood royalty: Joaquin Phoenix, the star who has overcome it all",https://english.elpais.com/culture/2024-10-28/from-a-cult-to-hollywood-royalty-joaquin-phoenix-the-star-who-has-overcome-it-all.html
"Success, failure and addictions: What happened to the teen idols of the 2000s?",https://english.elpais.com/people/2024-10-27/success-failure-and-addictions-what-happened-to-the-teen-idols-of-the-2000s.html
The Celtics and the curse of the champion,https://english.elpais.com/sports/2024-10-22/the-celtics-and-the-curse-of-the-champion.html
Jason de León: ‘There hasn’t been a Black Lives Matter moment for immigration. Trump could push it’,https://english.elpais.com/usa/elections/2024-11-01/jason-de-leon-there-hasnt-been-a-black-lives-matter-moment-for-immigration-trump-could-push-it.html
El Chapo plays his last cards from prison: ‘The inefficiency of my lawyers cost me my freedom’,https://english.elpais.com/usa/2024-10-28/el-chapo-plays-his-last-cards-from-prison-the-inefficiency-of-my-lawyers-cost-me-my-freedom.html
Why America is a flawed democracy,https://english.elpais.com/usa/elections/2024-10-26/why-america-is-a-flawed-democracy.html
The business magnates’ long goodbye: How the world’s richest people are planning their succession,https://english.elpais.com/economy-and-business/2024-10-27/the-business-magnates-long-goodbye-how-the-worlds-richest-people-are-planning-their-succession.html
Listen now LOS40 USA,https://los40.us/
LOS40 Music Awards Santander 2024: lista completa de nominados,https://los40.us/2024/los40-music-awards-santander-2024-lista-completa-de-nominados-25433.html
Actuaciones confirmadas en LOS40 Music Awards Santander 2024,https://los40.us/2024/los40-music-awards-santander-2024-estas-son-todas-las-actuaciones-confirmadas-25138.html
EL PAÍS offers free Spanish lessons with Gymglish,https://english.elpais.com/economy-and-business/2021-11-15/el-pais-offers-free-spanish-lessons-with-gymglish.html
Donald Trump gains support among Latino voters despite xenophobic rhetoric,https://english.elpais.com/usa/elections/2024-10-23/donald-trump-gains-support-among-latino-voters-despite-xenophobic-rhetoric.html
David Rieff: ‘It’s one thing to have a bad president and another to have a crazy one’,https://english.elpais.com/usa/elections/2024-10-23/david-rieff-its-one-thing-to-have-a-bad-president-and-another-to-have-a-crazy-one.html
Luxury handbag found in Gaza tunnel stars in Israel’s latest campaign against Hamas,https://english.elpais.com/international/2024-10-21/luxury-handbag-found-in-gaza-tunnel-stars-in-israels-latest-campaign-against-hamas.html
Ukraine does not have enough soldiers to stop Russia,https://english.elpais.com/international/2024-10-21/ukraine-does-not-have-enough-soldiers-to-stop-russia.html
The Evo Morales case: When sexual violence against women gets stuck in the political mud ,https://english.elpais.com/international/2024-10-20/the-evo-morales-case-when-sexual-violence-against-women-gets-stuck-in-the-political-mud.html
Venezuela kicks off its most uncertain presidential campaign,https://english.elpais.com/international/2024-10-07/the-latest-attack-by-the-cuban-government-against-independent-journalists-interrogations-threats-confiscations-and-exile.html
From self-driving cars in 2017 to a million robotaxis in 2020: Will the Cybercab be another one of Elon Musk’s unfulfilled promises?,https://english.elpais.com/technology/2024-10-11/from-self-driving-cars-in-2017-to-a-million-robotaxis-in-2020-will-the-cybercab-be-another-one-of-elon-musks-unfulfilled-promises.html
An economic paradox: When savings are both a good and a bad idea,https://english.elpais.com/economy-and-business/2024-10-13/trade-wars-also-have-winners-vietnam-and-mexico.html
The female rebels of the Spanish empire: The women who armed America’s fight for independence,https://english.elpais.com/culture/2024-10-20/the-female-rebels-of-the-spanish-empire-the-women-who-armed-americas-fight-for-independence.html
"Yalitza Aparicio: ‘When you get another perspective on life, you discover things you weren’t taught growing up’  ",https://english.elpais.com/international/2024-10-12/yalitza-aparicio-when-you-get-another-perspective-on-life-you-discover-things-you-werent-taught-growing-up.html
"Lucy Gilson, researcher: ‘The health system is a picture of how we live on the planet’",https://english.elpais.com/health/2024-10-11/lucy-gilson-researcher-the-health-system-is-a-picture-of-how-we-live-on-the-planet.html
CERN trains AI models to revolutionize cancer treatment,https://english.elpais.com/health/2024-10-05/cern-trains-ai-models-to-revolutionize-cancer-treatment.html
A psychoanalyst in search of the logic of the absurd,https://english.elpais.com/health/2024-10-03/a-psychoanalyst-in-search-of-the-logic-of-the-absurd.html
"Get up, stand up: How a job that ties us to a chair affects our body",https://english.elpais.com/lifestyle/2024-10-01/get-up-stand-up-how-a-job-that-ties-us-to-a-chair-affects-our-body.html
An ‘Olympics’ that allows doping? A billionaire’s controversial dream that could change sport forever,https://english.elpais.com/sports/2024-09-18/an-olympics-that-allows-doping-a-billionaires-controversial-dream-that-could-change-sport-forever.html
"Climbing without a rope, between freedom and psychopathy",https://english.elpais.com/sports/2024-09-11/steve-kerr-no-company-in-the-world-would-hire-someone-with-trumps-resume.html
